{
  "protocol_version": "telephone-line-codex-app-server-lead-profile-v1",
  "codex_command": "C:\\example\\codex.cmd",
  "codex_version": "codex-cli 0.147.0",
  "schema_file_count": 6,
  "schema_bytes": 256,
  "schema_fingerprint": "aaaaaaaaaaaaaaaaaaaaaaaaaaaaaaaaaaaaaaaaaaaaaaaaaaaaaaaaaaaaaaaa",
  "executable_sha256": "cccccccccccccccccccccccccccccccccccccccccccccccccccccccccccccccc",
  "service_tier": "default",
  "bound_at_utc": "2026-08-21T00:00:00.0000000+00:00"
}
